{
  "schema_version": "3.2.0",
  "authority_snapshot_id": "authority_2026-04-28_9bc31000",
  "proposal_id": "prop_2026-04-28_b3f1a2c4",
  "request_id": "req_2026-04-28_6a2d8800",
  "action_hash": "sha256:2991d5f888b4369ae368a0e1effa0d4c9e74fe4ddf8c607ab96849aba0b28691",
  "checked_at": "2026-04-28T09:14:33Z",
  "valid_until": "2026-04-28T09:15:33Z",
  "status": "active",
  "authority_digest": "sha256:59f5c1d85329618a5fc407792e4eb132933cff78bb882906a858e3585a20509a",
  "subjects": [
    {
      "kind": "approver",
      "identifier": "rene@acme-corp.example",
      "revision": "directory-1842",
      "status": "active",
      "scopes": [
        "email.send",
        "tenant:acme-corp"
      ]
    },
    {
      "kind": "policy",
      "identifier": "policy.high-risk-email.v1",
      "revision": "2026-04-15.3",
      "status": "active",
      "scopes": [
        "email.send"
      ]
    },
    {
      "kind": "workspace",
      "identifier": "workspace.acme-corp.support",
      "revision": "acl-7781",
      "status": "active",
      "scopes": [
        "tenant:acme-corp"
      ]
    },
    {
      "kind": "dispatcher",
      "identifier": "email-dispatcher",
      "revision": "credential-2026-q2",
      "status": "active",
      "scopes": [
        "email.send",
        "from:support@acme-corp.example"
      ]
    }
  ]
}
